{
  "ref_width": 1672,
  "ref_height": 941,
  "method_rules": {
    "base_grouping": {
      "base_a": [
        1
      ],
      "base_b": [
        2
      ]
    },
    "simple_geometry_not_in_png_sheet": true,
    "png_sheets_only_for": [
      "icon_png",
      "complex_png_whole"
    ]
  },
  "components": {
    "blue_card_base": {
      "category": "simple_geometry_svg_ooxml",
      "asset_plan": "svg_to_ooxml",
      "reuse": "one rounded white card reused for four module cards",
      "svg_hint": "rounded rectangle, white fill, light blue border/shadow"
    },
    "blue_num_badge": {
      "category": "simple_geometry_svg_ooxml",
      "asset_plan": "svg_to_ooxml",
      "reuse": "one blue circular number badge reused for 01-04",
      "svg_hint": "blue circle with editable number text overlay"
    },
    "blue_icon_circle": {
      "category": "simple_geometry_svg_ooxml",
      "asset_plan": "svg_to_ooxml",
      "reuse": "one pale-blue circle behind each module icon",
      "svg_hint": "large pale blue circle"
    },
    "blue_divider": {
      "category": "simple_geometry_svg_ooxml",
      "asset_plan": "svg_to_ooxml",
      "reuse": "thin vertical divider reused in all cards",
      "svg_hint": "vertical light-blue line"
    },
    "blue_bottom_bar": {
      "category": "simple_geometry_svg_ooxml",
      "asset_plan": "svg_to_ooxml",
      "reuse": "one rounded bottom process container",
      "svg_hint": "wide rounded translucent white rectangle with blue border"
    },
    "blue_bottom_circle": {
      "category": "simple_geometry_svg_ooxml",
      "asset_plan": "svg_to_ooxml",
      "reuse": "three repeated circular badges in process bar",
      "svg_hint": "blue gradient-like circle approximated as solid blue with white border"
    },
    "blue_arrow": {
      "category": "simple_geometry_svg_ooxml",
      "asset_plan": "svg_to_ooxml",
      "reuse": "two process arrows",
      "svg_hint": "right arrow line/chevron"
    },
    "blue_bottom_icon_building": {
      "category": "icon_png",
      "asset_plan": "generate_png_asset",
      "reuse": "bottom process icon for basic construction",
      "png_hint": "white classical building pictogram, no text"
    },
    "blue_bottom_icon_grid": {
      "category": "icon_png",
      "asset_plan": "generate_png_asset",
      "reuse": "bottom process icon for scenario application",
      "png_hint": "white four-square grid pictogram, no text"
    },
    "blue_bottom_icon_chart": {
      "category": "icon_png",
      "asset_plan": "generate_png_asset",
      "reuse": "bottom process icon for continuous optimization",
      "png_hint": "white rising bar chart pictogram, no text"
    },
    "blue_icon_database_cloud": {
      "category": "icon_png",
      "asset_plan": "generate_png_asset",
      "reuse": "one main data platform icon",
      "png_hint": "blue database cylinder with small white cloud, no text"
    },
    "blue_icon_teaching_monitor": {
      "category": "icon_png",
      "asset_plan": "generate_png_asset",
      "reuse": "one main teaching monitor and graduation cap icon",
      "png_hint": "blue monitor outline with graduation cap, no text"
    },
    "blue_icon_chat": {
      "category": "icon_png",
      "asset_plan": "generate_png_asset",
      "reuse": "one main chat bubble icon",
      "png_hint": "blue chat bubble with three white dots, no text"
    },
    "blue_icon_security_shield": {
      "category": "icon_png",
      "asset_plan": "generate_png_asset",
      "reuse": "one main shield lock icon",
      "png_hint": "blue shield with white lock, no text"
    },
    "green_card_base": {
      "category": "simple_geometry_svg_ooxml",
      "asset_plan": "svg_to_ooxml",
      "reuse": "one tall rounded card reused four times",
      "svg_hint": "white tall rounded rectangle with green border and subtle shadow"
    },
    "green_num_corner": {
      "category": "simple_geometry_svg_ooxml",
      "asset_plan": "svg_to_ooxml",
      "reuse": "one green rounded corner tab reused for 01-04",
      "svg_hint": "green rounded corner label with editable number text overlay"
    },
    "green_icon_ring": {
      "category": "simple_geometry_svg_ooxml",
      "asset_plan": "svg_to_ooxml",
      "reuse": "one circular ring behind each main green icon",
      "svg_hint": "two concentric circles, light green outer ring, green center"
    },
    "green_connector": {
      "category": "simple_geometry_svg_ooxml",
      "asset_plan": "svg_to_ooxml",
      "reuse": "dotted connector line and arrow circles between cards",
      "svg_hint": "green dotted line with circular arrow badge"
    },
    "green_card_bottom_wave": {
      "category": "simple_geometry_svg_ooxml",
      "asset_plan": "svg_to_ooxml",
      "reuse": "card bottom green wave decoration reused",
      "svg_hint": "soft green curved wave at card bottom"
    },
    "green_decor_plant": {
      "category": "icon_png",
      "asset_plan": "generate_png_asset",
      "reuse": "low-opacity decorative plant at bottom of card 1",
      "png_hint": "pale green plant decoration, no text"
    },
    "green_decor_gear": {
      "category": "icon_png",
      "asset_plan": "generate_png_asset",
      "reuse": "low-opacity decorative gear at bottom of card 2",
      "png_hint": "pale green gear decoration, no text"
    },
    "green_decor_document": {
      "category": "icon_png",
      "asset_plan": "generate_png_asset",
      "reuse": "low-opacity decorative document at bottom of card 3",
      "png_hint": "pale green document decoration, no text"
    },
    "green_decor_chart": {
      "category": "icon_png",
      "asset_plan": "generate_png_asset",
      "reuse": "low-opacity decorative growth chart at bottom of card 4",
      "png_hint": "pale green growth chart decoration, no text"
    },
    "green_icon_course_book": {
      "category": "icon_png",
      "asset_plan": "generate_png_asset",
      "reuse": "one main book icon",
      "png_hint": "white open book pictogram on green circular background, no text"
    },
    "green_icon_practice_tools": {
      "category": "icon_png",
      "asset_plan": "generate_png_asset",
      "reuse": "one main crossed wrench/screwdriver icon",
      "png_hint": "white crossed tool pictogram on green circular background, no text"
    },
    "green_icon_presentation": {
      "category": "icon_png",
      "asset_plan": "generate_png_asset",
      "reuse": "one main presentation chart icon",
      "png_hint": "white chart board pictogram on green circular background, no text"
    },
    "green_icon_growth_person": {
      "category": "icon_png",
      "asset_plan": "generate_png_asset",
      "reuse": "one main person star icon",
      "png_hint": "white person and star pictogram on green circular background, no text"
    },
    "green_small_person": {
      "category": "icon_png",
      "asset_plan": "generate_png_asset",
      "reuse": "small person icon",
      "png_hint": "white person pictogram on green circle"
    },
    "green_small_books": {
      "category": "icon_png",
      "asset_plan": "generate_png_asset",
      "reuse": "small stacked books icon",
      "png_hint": "white stacked books pictogram on green circle"
    },
    "green_small_group": {
      "category": "icon_png",
      "asset_plan": "generate_png_asset",
      "reuse": "small group collaboration icon",
      "png_hint": "white group pictogram on green circle"
    },
    "green_small_clipboard": {
      "category": "icon_png",
      "asset_plan": "generate_png_asset",
      "reuse": "small clipboard record icon",
      "png_hint": "white clipboard pictogram on green circle"
    },
    "green_small_folder": {
      "category": "icon_png",
      "asset_plan": "generate_png_asset",
      "reuse": "small folder icon",
      "png_hint": "white folder pictogram on green circle"
    },
    "green_small_chat": {
      "category": "icon_png",
      "asset_plan": "generate_png_asset",
      "reuse": "small chat message icon",
      "png_hint": "white chat bubble pictogram on green circle"
    },
    "green_small_peers": {
      "category": "icon_png",
      "asset_plan": "generate_png_asset",
      "reuse": "small peer group icon",
      "png_hint": "white two-person pictogram on green circle"
    },
    "green_small_leaf": {
      "category": "icon_png",
      "asset_plan": "generate_png_asset",
      "reuse": "small reflection leaf icon",
      "png_hint": "white leaf sprout pictogram on green circle"
    }
  },
  "slides": [
    {
      "slide": 1,
      "instances": [
        {
          "component": "blue_card_base",
          "id": "s1_blue_card_base_01",
          "bbox_px": [
            96,
            248,
            574,
            236
          ],
          "bbox_frac": [
            0.057416,
            0.263549,
            0.343301,
            0.250797
          ],
          "notes": ""
        },
        {
          "component": "blue_card_base",
          "id": "s1_blue_card_base_02",
          "bbox_px": [
            698,
            248,
            504,
            236
          ],
          "bbox_frac": [
            0.417464,
            0.263549,
            0.301435,
            0.250797
          ],
          "notes": ""
        },
        {
          "component": "blue_card_base",
          "id": "s1_blue_card_base_03",
          "bbox_px": [
            96,
            503,
            574,
            232
          ],
          "bbox_frac": [
            0.057416,
            0.534538,
            0.343301,
            0.246546
          ],
          "notes": ""
        },
        {
          "component": "blue_card_base",
          "id": "s1_blue_card_base_04",
          "bbox_px": [
            698,
            503,
            504,
            232
          ],
          "bbox_frac": [
            0.417464,
            0.534538,
            0.301435,
            0.246546
          ],
          "notes": ""
        },
        {